{
  "$schema": "http://json-schema.org/draft-07/schema#",
  "$id": "https://ai-patterns.dev/schemas/source.schema.json",
  "title": "Source",
  "type": "object",
  "additionalProperties": false,
  "required": ["id", "title", "author", "kind", "url", "patterns"],
  "properties": {
    "id":       { "type": "string", "pattern": "^s[1-9][0-9]*$" },
    "title":    { "type": "string", "minLength": 1 },
    "author":   { "type": "string", "minLength": 1 },
    "kind":     { "type": "string", "enum": ["post", "doc", "paper", "video", "book", "other"] },
    "url":      { "type": "string", "format": "uri", "pattern": "^https://" },
    "patterns": {
      "type": "array",
      "minItems": 1,
      "uniqueItems": true,
      "items": { "type": "string", "pattern": "^[a-z][a-z0-9-]*$" }
    }
  }
}
