{
  "id": "s20",
  "title": "Secure Software Development Framework (SSDF) Version 1.1",
  "author": "NIST",
  "kind": "doc",
  "url": "https://csrc.nist.gov/pubs/sp/800/218/final",
  "patterns": [
    "executable-safety-net",
    "quality-gate-agents",
    "scheduled-quality-sweeps",
    "skip-the-pull-request"
  ]
}
