{
  "id": "s77",
  "title": "Task Integration and the Worktree/Merge Workflow",
  "author": "Agent Studio (agent-orc)",
  "kind": "doc",
  "url": "https://github.com/agent-orc/agent-studio/blob/main/docs/concepts/task-integration-and-merge-workflow.md",
  "patterns": [
    "skip-the-pull-request"
  ]
}
